
{
  "$schema": "https://json-schema.org/draft/2020-12/schema",
  "$id": "https://greece-slip-db.org/schemas/slip-model.schema.json",
  "title": "Finite-Fault Slip Model (Greece Slip Model Database)",
  "description": "Schema for a single published finite-fault slip model of an earthquake in Greece. One file = one model (a given earthquake may have several models, from different authors/methods, each as its own record). Field set follows the parameterization described in Bonatis & Vavlas (this review) and is aligned with the SRCMOD .fsp convention (Mai & Thingbaijam, 2014) for interoperability.",
  "type": "object",
  "required": [
    "schema_version",
    "event",
    "reference",
    "fault_segments"
  ],
  "additionalProperties": false,
  "properties": {
    "schema_version": {
      "type": "string",
      "enum": ["1.0.0", "1.1.0"],
      "description": "Schema revision the record was written for. 1.1.0 = this revision (adds status, segment name, reference_point.position/along_strike_km/down_dip_km, provenance.data_origin/source_figure/verified_by/uncertainty_notes and further inversion.data_types); records written for 1.0.0 remain valid and keep 1.0.0."
    },
    "status": {
      "type": "string",
      "enum": ["published", "draft"],
      "default": "published",
      "description": "Publication status of the record. Drafts (work in progress, e.g. still containing placeholders) are validated but never published to the site."
    },
    "model_id": {
      "type": "string",
      "description": "Optional, informational; generated by the build if omitted. Not used to group models into earthquakes. Convention: <event_id>_<first_author>_<year>, e.g. arkalochori2021_bonatis_2024",
      "pattern": "^[a-z0-9]+_[a-z]+_[0-9]{4}$"
    },
    "event": {
      "type": "object",
      "description": "Properties of the earthquake itself (shared across all models of the same event).",
      "required": [
        "name",
        "origin_time",
        "magnitude",
        "magnitude_type",
        "hypocenter",
        "faulting_style"
      ],
      "additionalProperties": false,
      "properties": {
        "event_id": {
          "type": "string",
          "description": "Optional, informational; generated by the build if omitted (the build's event key, e.g. 2021-09-27_27-september-2021-central-crete). Not used to group models into earthquakes. Convention: a short identifier of the earthquake, e.g. arkalochori2021"
        },
        "name": {
          "type": "string",
          "description": "Common name, e.g. 'Arkalochori (Crete) 2021'"
        },
        "origin_time": {
          "type": ["string", "null"],
          "format": "date-time"
        },
        "magnitude": {
          "type": "number"
        },
        "magnitude_type": {
          "type": "string",
          "enum": ["Mw", "Ms", "ML", "Mb"]
        },
        "hypocenter": {
          "type": "object",
          "required": [
            "latitude",
            "longitude",
            "depth_km"
          ],
          "additionalProperties": false,
          "properties": {
            "latitude": {
              "type": ["number", "null"],
              "minimum": -90,
              "maximum": 90
            },
            "longitude": {
              "type": ["number", "null"],
              "minimum": -180,
              "maximum": 180
            },
            "depth_km": {
              "type": ["number", "null"],
              "minimum": 0
            }
          }
        },
        "faulting_style": {
          "type": "string",
          "enum": [
            "normal",
            "reverse",
            "strike-slip",
            "oblique-normal",
            "oblique-reverse",
            "unknown"
          ]
        },
        "tectonic_setting": {
          "type": "string",
          "description": "e.g. 'Hellenic Subduction Zone', 'Aegean back-arc extension', 'Kephalonia Transform Fault Zone'"
        },
        "region": {
          "type": "string",
          "description": "e.g. 'Crete', 'Samos', 'Ionian Islands'"
        }
      }
    },
    "reference": {
      "type": "object",
      "description": "Bibliographic source of this specific model.",
      "required": ["authors", "year"],
      "properties": {
        "authors": {
          "type": "array",
          "minItems": 1,
          "items": {
            "type": "string",
            "minLength": 1
          }
        },
        "year": {
          "type": "integer"
        },
        "title": {
          "type": "string"
        },
        "journal": {
          "type": "string"
        },
        "doi": {
          "type": ["string", "null"],
          "pattern": "^10\\.\\d{4,9}/\\S+$",
          "description": "Bare DOI without https://doi.org/ prefix"
        },
        "url": {
          "type": ["string", "null"],
          "format": "uri",
          "pattern": "^https?://"
        }
      }
    },
    "inversion": {
      "type": "object",
      "description": "How the model was derived (paper section 2.1).",
      "properties": {
        "data_types": {
          "type": "array",
          "description": "Data used to constrain the slip model. teleseismic = teleseismic body/surface waveforms; strong_motion = near-field strong-motion (accelerometer) records; regional_waveforms = regional broadband seismic waveforms (including empirical-Green-function / source-time-function inversions of regional records); GNSS = GNSS displacements (static offsets or high-rate); InSAR = InSAR line-of-sight displacements; GPS_static = legacy alias of static GNSS offsets (prefer GNSS); field_mapping = field observations of surface rupture/offsets; tsunami = tsunami waveforms (tide gauges, offshore pressure sensors); coastal_uplift = coastal uplift/subsidence markers (e.g. raised shorelines); leveling = levelling (vertical geodetic) lines; macroseismic = macroseismic intensity observations; other = data not covered above (describe them in inversion.notes).",
          "items": {
            "type": "string",
            "enum": [
              "teleseismic",
              "strong_motion",
              "GNSS",
              "InSAR",
              "GPS_static",
              "field_mapping",
              "other",
              "regional_waveforms",
              "tsunami",
              "coastal_uplift",
              "leveling",
              "macroseismic"
            ]
          }
        },
        "method": {
          "type": "string",
          "description": "e.g. 'linear least squares with Laplacian smoothing', 'Bayesian', 'simulated annealing'"
        },
        "green_function_model": {
          "type": "string",
          "description": "e.g. 'Okada uniform elastic half-space', 'layered 1D velocity model'"
        },
        "slip_type": {
          "type": "string",
          "enum": ["uniform", "variable"]
        },
        "smoothing_constraint": {
          "type": ["boolean","null"]
        },
        "notes": {
          "type": "string"
        }
      }
    },
    "fault_segments": {
      "type": "array",
      "minItems": 1,
      "description": "One or more planar fault segments making up the source geometry.",
      "items": {
        "type": "object",
        "required": [
          "segment_id",
          "strike_deg",
          "dip_deg",
          "length_km",
          "width_km",
          "top_depth_km",
          "reference_point"
        ],
        "additionalProperties": false,
        "properties": {
          "segment_id": {
            "type": "string"
          },
          "name": {
            "type": "string",
            "description": "Optional human-readable segment label shown in the browser, e.g. 'North segment (subevent 1)'."
          },
          "strike_deg": {
            "type": "number",
            "minimum": 0,
            "maximum": 360
          },
          "dip_deg": {
            "type": "number",
            "minimum": 0,
            "maximum": 90
          },
          "average_rake_deg": {
            "type": "number",
            "minimum": -180,
            "maximum": 180
          },
          "length_km": {
            "type": "number",
            "minimum": 0
          },
          "width_km": {
            "type": "number",
            "minimum": 0
          },
          "top_depth_km": {
            "type": ["number", "null"],
            "minimum": 0
          },
          "reference_point": {
            "type": "object",
            "description": "Geographic anchor of the segment (e.g. top-center of the fault plane). Fault-plane frame (same as patches): along_strike_km is measured from the segment start in the strike direction; down_dip_km is measured from the top edge along the dipping plane. Strike/dip follow the Aki-Richards right-hand convention (the fault dips to the right when looking along strike), so the down-dip azimuth is strike + 90 degrees. Which point of the plane latitude/longitude refer to is given by position, or exactly by along_strike_km/down_dip_km when present; if neither is given, top_center is assumed.",
            "required": [
              "latitude",
              "longitude"
            ],
            "additionalProperties": false,
            "properties": {
              "latitude": {
                "type": ["number", "null"]
              },
              "longitude": {
                "type": ["number", "null"]
              },
              "position": {
                "type": "string",
                "enum": ["top_center", "top_left", "center", "hypocenter", "unknown"],
                "description": "Which point of the fault plane latitude/longitude refer to (its surface projection for points below the top edge). top_center = midpoint of the top edge; top_left = the patch-coordinate origin (along_strike_km = 0 on the top edge); center = centre of the plane; hypocenter = the event hypocenter (latitude/longitude are its epicenter; give its fault-plane position in along_strike_km/down_dip_km when known); unknown = not stated. If missing, the browser assumes top_center and labels it as assumed."
              },
              "along_strike_km": {
                "type": "number",
                "minimum": 0,
                "description": "Optional along-strike fault-plane coordinate of the reference point (same frame as patches). Give it together with down_dip_km (both or neither); the pair defines the placement exactly and overrides position."
              },
              "down_dip_km": {
                "type": "number",
                "minimum": 0,
                "description": "Optional down-dip fault-plane coordinate of the reference point, measured from the top edge (same frame as patches). Give it together with along_strike_km (both or neither); the pair defines the placement exactly and overrides position."
              }
            },
            "dependentRequired": {
              "along_strike_km": ["down_dip_km"],
              "down_dip_km": ["along_strike_km"]
            }
          },
          "patch_grid": {
            "type": "object",
            "description": "Discretization of the segment into along-strike x down-dip subfault patches (omit for uniform-slip models).",
            "additionalProperties": false,
            "properties": {
              "n_along_strike": {
                "type": "integer",
                "minimum": 1
              },
              "n_down_dip": {
                "type": "integer",
                "minimum": 1
              },
              "patch_length_km": {
                "type": "number"
              },
              "patch_width_km": {
                "type": "number"
              }
            }
          },
          "patches": {
            "type": "array",
            "description": "Per-patch slip values. Omit or leave empty for uniform-slip models; use average_rake_deg + summary_metrics.max_slip_m instead.",
            "items": {
              "type": "object",
              "required": [
                "along_strike_km",
                "down_dip_km",
                "latitude",
                "longitude",
                "depth_km",
                "slip_m",
                "rake_deg"
              ],
              "additionalProperties": false,
              "properties": {
                "along_strike_km": {
                  "type": "number",
                  "description": "Position of patch center along strike, from segment start"
                },
                "down_dip_km": {
                  "type": "number",
                  "description": "Position of patch center down-dip, from the top edge"
                },
                "latitude": {
                  "type": ["number", "null"]
                },
                "longitude": {
                  "type": ["number", "null"]
                },
                "depth_km": {
                  "type": ["number", "null"],
                  "minimum": 0
                },
                "slip_m": {
                  "type": "number",
                  "minimum": 0
                },
                "rake_deg": {
                  "type": "number",
                  "minimum": -180,
                  "maximum": 180
                },
                "rise_time_s": {
                  "type": ["number", "null"]
                },
                "rupture_time_s": {
                  "type": ["number", "null"],
                  "description": "Time of rupture onset at this patch, for kinematic (time-dependent) models"
                }
              }
            }
          }
        }
      }
    },
    "summary_metrics": {
      "type": "object",
      "description": "Derived scalar values for cross-event comparison and scaling analyses (paper section 3.4).",
      "properties": {
        "max_slip_m": {
          "type": "number",
          "minimum": 0
        },
        "mean_slip_m": {
          "type": "number",
          "minimum": 0
        },
        "rupture_area_km2": {
          "type": ["number", "null"],
          "minimum": 0
        },
        "seismic_moment_Nm": {
          "type": ["number", "null"],
          "minimum": 0
        }
      }
    },
    "model_variant": {
      "type": "object",
      "description": "Optional flag for non-standard model types discussed in the paper.",
      "properties": {
        "phase": {
          "type": "string",
          "enum": ["coseismic", "postseismic"],
          "default": "coseismic"
        }
      }
    },
    "provenance": {
      "type": "object",
      "description": "FAIR / archival metadata (paper section 5.1).",
      "properties": {
        "compiled_by": {
          "type": "string"
        },
        "date_added": {
          "type": "string",
          "format": "date"
        },
        "license": {
          "type": ["string", "null"],
          "description": "Licence of this record (e.g. 'CC-BY-4.0'). Leave null or omit when unknown; the browser then shows 'not specified'. Values digitized from published figures may carry the publisher's terms."
        },
        "source_file_url": {
          "type": ["string", "null"],
          "format": "uri",
          "description": "Link to original author-supplied supplementary data, if available"
        },
        "data_origin": {
          "type": "string",
          "enum": [
            "author_supplied",
            "srcmod",
            "digitized_figure",
            "digitized_table",
            "derived",
            "other"
          ],
          "description": "Where the slip values come from: author_supplied = numerical values supplied by the authors (e.g. supplementary file); srcmod = taken from the SRCMOD database; digitized_figure = digitized from a published figure; digitized_table = transcribed from a published table; derived = computed from other published values; other = anything else (explain in inversion.notes)."
        },
        "source_figure": {
          "type": "string",
          "description": "Figure or table (and panel) of the source publication the values were digitized or transcribed from, e.g. 'Figure 5', 'Figure 3b', 'Table 2'."
        },
        "verified_by": {
          "type": "string",
          "description": "Who checked the digitized/transcribed values against the source publication."
        },
        "uncertainty_notes": {
          "type": "string",
          "description": "Free-text notes on the uncertainty of the stored values (digitization resolution, colour-scale quantization, etc.)."
        }
      }
    }
  }
}
